[
  {
    "func_a": {
      "name": "main",
      "file": "detect-ast-similarity.py",
      "line": 246
    },
    "func_b": {
      "name": "main",
      "file": "detect-code-embedding.py",
      "line": 195
    },
    "scores": {
      "token_hash_match": true,
      "clone_type": 1,
      "sequence_length": 278
    },
    "final_score": 1.0,
    "strategy": "token_clone"
  },
  {
    "func_a": {
      "name": "main",
      "file": "detect-ast-similarity.py",
      "line": 246
    },
    "func_b": {
      "name": "main",
      "file": "detect-winnowing.py",
      "line": 259
    },
    "scores": {
      "token_hash_match": true,
      "clone_type": 1,
      "sequence_length": 278
    },
    "final_score": 1.0,
    "strategy": "token_clone"
  },
  {
    "func_a": {
      "name": "detect_bag_of_ast_duplicates",
      "file": "detect-bag-of-ast.py",
      "line": 87
    },
    "func_b": {
      "name": "detect_pdg_duplicates",
      "file": "detect-pdg-semantic.py",
      "line": 138
    },
    "scores": {
      "token_hash_match": true,
      "clone_type": 1,
      "sequence_length": 350
    },
    "final_score": 1.0,
    "strategy": "token_clone"
  },
  {
    "func_a": {
      "name": "main",
      "file": "detect-bag-of-ast.py",
      "line": 149
    },
    "func_b": {
      "name": "main",
      "file": "detect-pdg-semantic.py",
      "line": 203
    },
    "scores": {
      "token_hash_match": true,
      "clone_type": 1,
      "sequence_length": 240
    },
    "final_score": 1.0,
    "strategy": "token_clone"
  },
  {
    "func_a": {
      "name": "main",
      "file": "detect-bag-of-ast.py",
      "line": 149
    },
    "func_b": {
      "name": "main",
      "file": "detect-token-clones.py",
      "line": 210
    },
    "scores": {
      "token_hash_match": true,
      "clone_type": 1,
      "sequence_length": 240
    },
    "final_score": 1.0,
    "strategy": "token_clone"
  },
  {
    "func_a": {
      "name": "main",
      "file": "detect-code-embedding.py",
      "line": 195
    },
    "func_b": {
      "name": "main",
      "file": "detect-winnowing.py",
      "line": 259
    },
    "scores": {
      "token_hash_match": true,
      "clone_type": 1,
      "sequence_length": 278
    },
    "final_score": 1.0,
    "strategy": "token_clone"
  },
  {
    "func_a": {
      "name": "main",
      "file": "detect-fuzzy-names.py",
      "line": 338
    },
    "func_b": {
      "name": "main",
      "file": "detect-signature-match.py",
      "line": 378
    },
    "scores": {
      "token_hash_match": true,
      "clone_type": 1,
      "sequence_length": 222
    },
    "final_score": 1.0,
    "strategy": "token_clone"
  },
  {
    "func_a": {
      "name": "main",
      "file": "detect-pdg-semantic.py",
      "line": 203
    },
    "func_b": {
      "name": "main",
      "file": "detect-token-clones.py",
      "line": 210
    },
    "scores": {
      "token_hash_match": true,
      "clone_type": 1,
      "sequence_length": 240
    },
    "final_score": 1.0,
    "strategy": "token_clone"
  },
  {
    "func_a": {
      "name": "visit_Name",
      "file": "extract-functions-ast-py.py",
      "line": 54
    },
    "func_b": {
      "name": "visit_Attribute",
      "file": "extract-functions-ast-py.py",
      "line": 81
    },
    "scores": {
      "token_hash_match": true,
      "clone_type": 1,
      "sequence_length": 37
    },
    "final_score": 1.0,
    "strategy": "token_clone"
  },
  {
    "func_a": {
      "name": "visit_FunctionDef",
      "file": "extract-functions-ast-py.py",
      "line": 66
    },
    "func_b": {
      "name": "visit_AsyncFunctionDef",
      "file": "extract-functions-ast-py.py",
      "line": 74
    },
    "scores": {
      "token_hash_match": true,
      "clone_type": 1,
      "sequence_length": 50
    },
    "final_score": 1.0,
    "strategy": "token_clone"
  },
  {
    "func_a": {
      "name": "_unparse_annotation",
      "file": "extract-functions-ast-py.py",
      "line": 168
    },
    "func_b": {
      "name": "_unparse_default",
      "file": "extract-functions-ast-py.py",
      "line": 178
    },
    "scores": {
      "token_hash_match": true,
      "clone_type": 1,
      "sequence_length": 39
    },
    "final_score": 1.0,
    "strategy": "token_clone"
  },
  {
    "func_a": {
      "name": "visit_FunctionDef",
      "file": "extract-functions-ast-py.py",
      "line": 410
    },
    "func_b": {
      "name": "visit_AsyncFunctionDef",
      "file": "extract-functions-ast-py.py",
      "line": 417
    },
    "scores": {
      "token_hash_match": true,
      "clone_type": 1,
      "sequence_length": 45
    },
    "final_score": 1.0,
    "strategy": "token_clone"
  },
  {
    "func_a": {
      "name": "lcs_similarity",
      "file": "detect-ast-similarity.py",
      "line": 100
    },
    "func_b": {
      "name": "overlap_coefficient",
      "file": "lib/common.py",
      "line": 214
    },
    "scores": {
      "token_hash_match": true,
      "clone_type": 2,
      "sequence_length": 58
    },
    "final_score": 0.9,
    "strategy": "token_clone"
  },
  {
    "func_a": {
      "name": "lcs_similarity",
      "file": "detect-ast-similarity.py",
      "line": 100
    },
    "func_b": {
      "name": "_git_head",
      "file": "lib/resource_policy.py",
      "line": 325
    },
    "scores": {
      "token_hash_match": true,
      "clone_type": 2,
      "sequence_length": 58
    },
    "final_score": 0.9,
    "strategy": "token_clone"
  },
  {
    "func_a": {
      "name": "main",
      "file": "detect-ast-similarity.py",
      "line": 246
    },
    "func_b": {
      "name": "_extract_metrics",
      "file": "detect-metric-similarity.py",
      "line": 110
    },
    "scores": {
      "token_hash_match": true,
      "clone_type": 2,
      "sequence_length": 278
    },
    "final_score": 0.9,
    "strategy": "token_clone"
  },
  {
    "func_a": {
      "name": "ast_node_vector",
      "file": "detect-bag-of-ast.py",
      "line": 29
    },
    "func_b": {
      "name": "normalize_type",
      "file": "detect-signature-match.py",
      "line": 71
    },
    "scores": {
      "token_hash_match": true,
      "clone_type": 2,
      "sequence_length": 123
    },
    "final_score": 0.9,
    "strategy": "token_clone"
  },
  {
    "func_a": {
      "name": "build_embedding",
      "file": "detect-code-embedding.py",
      "line": 70
    },
    "func_b": {
      "name": "__init__",
      "file": "extract-functions-ast-py.py",
      "line": 354
    },
    "scores": {
      "token_hash_match": true,
      "clone_type": 2,
      "sequence_length": 85
    },
    "final_score": 0.9,
    "strategy": "token_clone"
  },
  {
    "func_a": {
      "name": "build_embedding",
      "file": "detect-code-embedding.py",
      "line": 70
    },
    "func_b": {
      "name": "_is_test_file",
      "file": "extract-functions-ast-py.py",
      "line": 444
    },
    "scores": {
      "token_hash_match": true,
      "clone_type": 2,
      "sequence_length": 85
    },
    "final_score": 0.9,
    "strategy": "token_clone"
  },
  {
    "func_a": {
      "name": "detect_embedding_duplicates",
      "file": "detect-code-embedding.py",
      "line": 126
    },
    "func_b": {
      "name": "detect_fuzzy_duplicates",
      "file": "detect-fuzzy-names.py",
      "line": 274
    },
    "scores": {
      "token_hash_match": true,
      "clone_type": 2,
      "sequence_length": 371
    },
    "final_score": 0.9,
    "strategy": "token_clone"
  },
  {
    "func_a": {
      "name": "main",
      "file": "detect-code-embedding.py",
      "line": 195
    },
    "func_b": {
      "name": "_extract_metrics",
      "file": "detect-metric-similarity.py",
      "line": 110
    },
    "scores": {
      "token_hash_match": true,
      "clone_type": 2,
      "sequence_length": 278
    },
    "final_score": 0.9,
    "strategy": "token_clone"
  },
  {
    "func_a": {
      "name": "expand_abbreviations",
      "file": "detect-fuzzy-names.py",
      "line": 179
    },
    "func_b": {
      "name": "_decorator_names",
      "file": "extract-functions-ast-py.py",
      "line": 278
    },
    "scores": {
      "token_hash_match": true,
      "clone_type": 2,
      "sequence_length": 33
    },
    "final_score": 0.9,
    "strategy": "token_clone"
  },
  {
    "func_a": {
      "name": "levenshtein_score",
      "file": "detect-fuzzy-names.py",
      "line": 187
    },
    "func_b": {
      "name": "_decorator_name",
      "file": "extract-functions-ast-py.py",
      "line": 270
    },
    "scores": {
      "token_hash_match": true,
      "clone_type": 2,
      "sequence_length": 25
    },
    "final_score": 0.9,
    "strategy": "token_clone"
  },
  {
    "func_a": {
      "name": "synonym_boost",
      "file": "detect-fuzzy-names.py",
      "line": 197
    },
    "func_b": {
      "name": "detect_tfidf_duplicates",
      "file": "detect-tfidf-index.py",
      "line": 156
    },
    "scores": {
      "token_hash_match": true,
      "clone_type": 2,
      "sequence_length": 183
    },
    "final_score": 0.9,
    "strategy": "token_clone"
  },
  {
    "func_a": {
      "name": "abbreviation_boost",
      "file": "detect-fuzzy-names.py",
      "line": 238
    },
    "func_b": {
      "name": "__init__",
      "file": "merge-signals.py",
      "line": 696
    },
    "scores": {
      "token_hash_match": true,
      "clone_type": 2,
      "sequence_length": 96
    },
    "final_score": 0.9,
    "strategy": "token_clone"
  },
  {
    "func_a": {
      "name": "compute_final_score",
      "file": "detect-fuzzy-names.py",
      "line": 261
    },
    "func_b": {
      "name": "visit_alias",
      "file": "extract-functions-ast-py.py",
      "line": 86
    },
    "scores": {
      "token_hash_match": true,
      "clone_type": 2,
      "sequence_length": 56
    },
    "final_score": 0.9,
    "strategy": "token_clone"
  },
  {
    "func_a": {
      "name": "compute_final_score",
      "file": "detect-fuzzy-names.py",
      "line": 261
    },